{
  "id": "ftl-postmortem",
  "type": "Talk",
  "title": "FTL Postmortem: Designing Without a Pitch",
  "creator": "Matthew Davis and Justin Ma",
  "publisher": "GDC",
  "year": 2013,
  "length": "49 min",
  "access": "Free",
  "level": "All levels",
  "topics": [
    "Production",
    "Iteration",
    "Crowdfunding"
  ],
  "games": [
    "FTL: Faster Than Light"
  ],
  "description": "Subset Games’ founders explain how a small prototype made for themselves became FTL, covering influences, remote collaboration, iteration, public response, crowdfunding, and decisions made without a conventional publisher pitch.",
  "useful": "A candid small-team production history that separates the appealing finished game from the uncertainty of finding it.",
  "url": "https://www.youtube.com/watch?v=P4Um97AUqp4",
  "image": "https://i.ytimg.com/vi/P4Um97AUqp4/hqdefault.jpg",
  "subjects": [
    "Production",
    "Game design",
    "History"
  ],
  "lengthClass": "30–120 min",
  "relevance": [
    "Historical",
    "Practical"
  ],
  "audience": "Independent developers studying prototypes, collaboration, crowdfunding, and emergent project direction.",
  "learning": [
    "Trace a personal prototype into a commercial project",
    "See how feedback and funding changed production",
    "Identify benefits and risks of designing without a formal pitch"
  ],
  "next": [
    "into-breach-postmortem",
    "spelunky-book",
    "finishing-a-game"
  ],
  "lastChecked": "2026-07-18",
  "addedAt": "2026-07-18",
  "editorial": {
    "status": "published",
    "reviewedAt": "2026-07-18",
    "note": ""
  }
}
