{
  "id": "gdc-vault",
  "type": "Archive",
  "title": "GDC Vault",
  "creator": "Game Developers Conference",
  "publisher": "GDC",
  "year": 2026,
  "length": "Video and slide archive",
  "access": "Mixed",
  "level": "All levels",
  "topics": [
    "Production",
    "Game design",
    "Programming",
    "Audio",
    "Visual art",
    "Narrative",
    "History"
  ],
  "games": [],
  "description": "The official archive of GDC session videos, audio, and presentation material, combining free records with subscriber-only sessions.",
  "useful": "The largest single professional-talk collection in this catalogue; search by speaker, discipline, event, or game.",
  "url": "https://gdcvault.com/",
  "image": "",
  "subjects": [
    "Game design",
    "Programming",
    "Production",
    "Audio",
    "Visual art",
    "Narrative",
    "History"
  ],
  "lengthClass": "Reference",
  "relevance": [
    "Practical",
    "Historical"
  ],
  "audience": "Developers and students searching for professional talks by discipline, speaker, event, or game.",
  "learning": [
    "Search a large professional conference archive",
    "Separate free sessions from subscriber material",
    "Use talks as starting points for deeper research"
  ],
  "next": [
    "designing-journey",
    "doom-postmortem",
    "doom-behind-music"
  ],
  "lastChecked": "2026-07-18",
  "addedAt": "2026-07-18",
  "editorial": {
    "status": "published",
    "reviewedAt": "2026-07-19",
    "note": "Kept as a catalogue-only source directory rather than a learning-path step because it spans thousands of sessions and multiple disciplines."
  }
}
