{
  "id": "gaming-accessibility-fundamentals",
  "type": "Course",
  "title": "Gaming Accessibility Fundamentals",
  "creator": "Microsoft",
  "publisher": "Microsoft Learn",
  "year": 2026,
  "length": "Learning path",
  "access": "Free",
  "level": "Introductory",
  "topics": [
    "Accessibility",
    "Disability",
    "Inclusive design"
  ],
  "games": [],
  "description": "A free learning path introducing disability, common barriers in games, assistive technology, accessibility principles, and the roles different team members play in inclusive development.",
  "useful": "It establishes shared foundations before a team jumps into long checklists or isolated feature decisions.",
  "url": "https://learn.microsoft.com/en-us/training/paths/gaming-accessibility-fundamentals/",
  "image": "",
  "subjects": [
    "Accessibility",
    "Production"
  ],
  "lengthClass": "Long-form",
  "relevance": [
    "Practical",
    "Theoretical"
  ],
  "audience": "Anyone entering game development, including non-specialists who need a common accessibility vocabulary.",
  "learning": [
    "Describe disability through barriers rather than stereotypes",
    "Recognize common obstacles across game systems",
    "Identify how each development role can improve access"
  ],
  "next": [
    "accessible-player-experiences",
    "xbox-accessibility-guidelines",
    "accessibility-guidelines"
  ],
  "lastChecked": "2026-07-18",
  "addedAt": "2026-07-18",
  "editorial": {
    "status": "published",
    "reviewedAt": "2026-07-18",
    "note": ""
  }
}
