{
  "id": "how-talk-videogames",
  "type": "Book",
  "title": "How to Talk about Videogames",
  "creator": "Ian Bogost",
  "publisher": "University of Minnesota Press",
  "year": 2015,
  "length": "208 pages",
  "access": "Paid",
  "level": "Introductory",
  "topics": [
    "Game criticism",
    "Writing",
    "Culture"
  ],
  "games": [
    "Flappy Bird",
    "Ms. Pac-Man",
    "Mario Kart 8"
  ],
  "description": "A collection of short critical essays that examines particular games, mechanics, objects, and habits with close attention. The subjects range from major releases to mundane and unfashionable games.",
  "useful": "It models criticism that begins with what a game actually does instead of using games only as examples of a preselected theory.",
  "url": "https://www.upress.umn.edu/9780816699124/how-to-talk-about-videogames/",
  "image": "https://covers.openlibrary.org/b/isbn/9780816699124-L.jpg?default=false",
  "subjects": [
    "Criticism & theory"
  ],
  "lengthClass": "Long-form",
  "relevance": [
    "Theoretical",
    "Historical"
  ],
  "audience": "Beginning critics, developers, and general readers who want to write more precisely about games.",
  "learning": [
    "Build an argument from close attention to a game",
    "Write about mechanics alongside culture and material objects",
    "Choose a critical scale appropriate to the subject"
  ],
  "next": [
    "game-studies-journal",
    "critical-play",
    "persuasive-games"
  ],
  "lastChecked": "2026-07-18",
  "addedAt": "2026-07-18",
  "editorial": {
    "status": "published",
    "reviewedAt": "2026-07-18",
    "note": ""
  }
}
